source_path,package_location,status,reason
/Users/dlev2617/Sydney Uni Dropbox/David Levinson/iMove - Liverpool Project/Analysis/Access_Data_Maps/FrequencyMatrix,data/access_frequency_matrix; code/notebooks/frequency_matrix,curated_subset_copied,"Final access comparison tables, notebooks, and compact ZIP outputs copied; plots/checkpoints excluded."
/Users/dlev2617/Sydney Uni Dropbox/David Levinson/iMove - Liverpool Project/Analysis/LandUseAllocation,data/land_use_allocation; code/notebooks/land_use_allocation,curated_subset_copied,"Control totals, forecasts, concordances, and notebooks copied; full raw spatial tree not copied."
/Users/dlev2617/Sydney Uni Dropbox/David Levinson/iMove - Liverpool Project/Analysis/developable land/Bahman-QGIS,data/scenario_land_use_and_access; data/spatial_inputs; code/qgis_projects,curated_subset_copied,"Scenario CSVs, selected spatial inputs, and QGIS projects copied; multi-GB raw roads/lots/full mesh-block files excluded."
/Users/dlev2617/Sydney Uni Dropbox/David Levinson/iMove - Liverpool Project/Analysis/developable land/Results-Hao2Bahman,data/access_outputs,aggregates_and_paper_cutoffs_copied,Aggregated access outputs and paper-cutoff baseline outputs copied; detailed full cutoff grids excluded to avoid redundant bulk.
/Users/dlev2617/Sydney Uni Dropbox/David Levinson/iMove - Liverpool Project/Analysis/Super Block/SHP,data/spatial_inputs/superblock_geometries,selected_geometries_copied,Superblock/grid/TOD geometries copied; large lots/residential/outside-Liverpool layers excluded.
